Week,Position,Rise/Fall,Previous Rank,New Peak?,Re-peak?,Total Weighted Points,%,Song,Artist,Album,Streams,Sales,Airplay,Streams Points,Sales Points,Airplay Points,Streams Units,Sales Units,Airplay Units,Streams %,Sales %,Airplay %,Total Units,Current Week Points,Previous Week Points,Two Weeks Ago Points,Peak,WOC,Peak Streak
2021-11-12,1,NEW,--,True,False,121,--,All Too Well (Taylor's Version),Taylor Swift,Red (Taylor's Version),16,7,10,80,21,20,800000,21000,1000000,0.44,0.01,0.55,1821000,121,0,0,1,1,1
2021-11-12,2,NEW,--,True,False,50,--,Treacherous (Taylor's Version),Taylor Swift,Red (Taylor's Version),6,6,1,30,18,2,300000,18000,100000,0.72,0.04,0.24,418000,50,0,0,2,1,1
2021-11-12,3,NEW,--,True,False,50,--,Red (Taylor's Version),Taylor Swift,Red (Taylor's Version),6,6,1,30,18,2,300000,18000,100000,0.72,0.04,0.24,418000,50,0,0,3,1,1
2021-11-12,4,NEW,--,True,False,42,--,I Knew You Were Trouble (Taylor's Version),Taylor Swift,Red (Taylor's Version),5,5,1,25,15,2,250000,15000,100000,0.68,0.04,0.27,365000,42,0,0,4,1,1
2021-11-12,5,NEW,--,True,False,42,--,State of Grace (Taylor's Version),Taylor Swift,Red (Taylor's Version),5,5,1,25,15,2,250000,15000,100000,0.68,0.04,0.27,365000,42,0,0,5,1,1
2021-11-12,6,NEW,--,True,False,42,--,Babe (Taylor's Version) (From the Vault),Taylor Swift,Red (Taylor's Version),5,5,1,25,15,2,250000,15000,100000,0.68,0.04,0.27,365000,42,0,0,6,1,1
2021-11-12,7,NEW,--,True,False,42,--,Better Man (Taylor's Version) (From the Vault),Taylor Swift,Red (Taylor's Version),5,5,1,25,15,2,250000,15000,100000,0.68,0.04,0.27,365000,42,0,0,7,1,1
2021-11-12,8,NEW,--,True,False,42,--,Ronan (Taylor's Version),Taylor Swift,Red (Taylor's Version),5,5,1,25,15,2,250000,15000,100000,0.68,0.04,0.27,365000,42,0,0,8,1,1
2021-11-12,9,NEW,--,True,False,41,--,The Moment I Knew (Taylor's Version),Taylor Swift,Red (Taylor's Version),5,4,2,25,12,4,250000,12000,200000,0.54,0.03,0.43,462000,41,0,0,9,1,1
2021-11-12,10,NEW,--,True,False,34,--,All Too Well (10 Minute Version) (Taylor's Version) (From the Vault),Taylor Swift,Red (Taylor's Version),4,4,1,20,12,2,200000,12000,100000,0.64,0.04,0.32,312000,34,0,0,10,1,1
2021-11-12,11,NEW,--,True,False,34,--,The Very First Night (Taylor's Version) (From the Vault),Taylor Swift,Red (Taylor's Version),4,4,1,20,12,2,200000,12000,100000,0.64,0.04,0.32,312000,34,0,0,11,1,1
2021-11-12,12,NEW,--,True,False,34,--,Forever Winter (Taylor's Version) (From the Vault),Taylor Swift,Red (Taylor's Version),4,4,1,20,12,2,200000,12000,100000,0.64,0.04,0.32,312000,34,0,0,12,1,1
2021-11-12,13,NEW,--,True,False,34,--,Message in a Bottle (Taylor's Version) (From the Vault),Taylor Swift,Red (Taylor's Version),4,4,1,20,12,2,200000,12000,100000,0.64,0.04,0.32,312000,34,0,0,13,1,1
2021-11-12,14,NEW,--,True,False,34,--,Girl at Home (Taylor's Version),Taylor Swift,Red (Taylor's Version),4,4,1,20,12,2,200000,12000,100000,0.64,0.04,0.32,312000,34,0,0,14,1,1
2021-11-12,15,NEW,--,True,False,34,--,Come Back...Be Here (Taylor's Version),Taylor Swift,Red (Taylor's Version),4,4,1,20,12,2,200000,12000,100000,0.64,0.04,0.32,312000,34,0,0,15,1,1
2021-11-12,16,NEW,--,True,False,34,--,Begin Again (Taylor's Version),Taylor Swift,Red (Taylor's Version),4,4,1,20,12,2,200000,12000,100000,0.64,0.04,0.32,312000,34,0,0,16,1,1
2021-11-12,17,NEW,--,True,False,26,--,Run (feat. Ed Sheeran) (Taylor’s Version) (From the Vault),Taylor Swift,Red (Taylor's Version),3,3,1,15,9,2,150000,9000,100000,0.58,0.03,0.39,259000,26,0,0,17,1,1
2021-11-12,18,NEW,--,True,False,26,--,I Bet You Think About Me (feat. Chris Stapleton) (Taylor’s Version) (From the Vault),Taylor Swift,Red (Taylor's Version),3,3,1,15,9,2,150000,9000,100000,0.58,0.03,0.39,259000,26,0,0,18,1,1
2021-11-12,19,NEW,--,True,False,26,--,Nothing New (feat. Phoebe Bridgers) (Taylor’s Version) (From the Vault),Taylor Swift,Red (Taylor's Version),3,3,1,15,9,2,150000,9000,100000,0.58,0.03,0.39,259000,26,0,0,19,1,1
2021-11-12,20,NEW,--,True,False,26,--,State of Grace (Acoustic Version) (Taylor's Version),Taylor Swift,Red (Taylor's Version),3,3,1,15,9,2,150000,9000,100000,0.58,0.03,0.39,259000,26,0,0,20,1,1
2021-11-12,21,NEW,--,True,False,26,--,Starlight (Taylor's Version),Taylor Swift,Red (Taylor's Version),3,3,1,15,9,2,150000,9000,100000,0.58,0.03,0.39,259000,26,0,0,21,1,1
2021-11-12,22,NEW,--,True,False,26,--,Everything Has Changed (feat. Ed Sheeran) (Taylor’s Version),Taylor Swift,Red (Taylor's Version),3,3,1,15,9,2,150000,9000,100000,0.58,0.03,0.39,259000,26,0,0,22,1,1
2021-11-12,23,NEW,--,True,False,26,--,The Lucky One (Taylor's Version),Taylor Swift,Red (Taylor's Version),3,3,1,15,9,2,150000,9000,100000,0.58,0.03,0.39,259000,26,0,0,23,1,1
2021-11-12,24,NEW,--,True,False,26,--,Sad Beautiful Tragic (Taylor's Version),Taylor Swift,Red (Taylor's Version),3,3,1,15,9,2,150000,9000,100000,0.58,0.03,0.39,259000,26,0,0,24,1,1
2021-11-12,25,NEW,--,True,False,26,--,Holy Ground (Taylor's Version),Taylor Swift,Red (Taylor's Version),3,3,1,15,9,2,150000,9000,100000,0.58,0.03,0.39,259000,26,0,0,25,1,1
2021-11-12,26,RE,--,True,False,26,--,The Last Time (feat. Gary Lightbody of Snow Patrol) (Taylor’s Version),Taylor Swift,Red (Taylor's Version),3,3,1,15,9,2,150000,9000,100000,0.58,0.03,0.39,259000,26,0,0,26,1,1
2021-11-12,27,RE,--,True,False,26,--,Stay Stay Stay (Taylor's Version),Taylor Swift,Red (Taylor's Version),3,3,1,15,9,2,150000,9000,100000,0.58,0.03,0.39,259000,26,0,0,27,1,1
2021-11-12,28,RE,--,True,False,26,--,We Are Never Ever Getting Back Together (Taylor's Version),Taylor Swift,Red (Taylor's Version),3,3,1,15,9,2,150000,9000,100000,0.58,0.03,0.39,259000,26,0,0,28,1,1
2021-11-12,29,RE,--,True,False,26,--,I Almost Do (Taylor's Version),Taylor Swift,Red (Taylor's Version),3,3,1,15,9,2,150000,9000,100000,0.58,0.03,0.39,259000,26,0,0,29,1,1
2021-11-12,30,RE,--,True,False,26,--,22 (Taylor's Version),Taylor Swift,Red (Taylor's Version),3,3,1,15,9,2,150000,9000,100000,0.58,0.03,0.39,259000,26,0,0,30,1,1
2021-11-12,31,RE,--,False,False,10,--,Love Story (Taylor’s Version),Taylor Swift,Fearless (Taylor's Version),1,1,1,5,3,2,50000,3000,100000,0.33,0.02,0.65,153000,10,0,0,1,15,2
2021-11-12,32,RE,--,False,False,10,--,Fifteen (Taylor’s Version),Taylor Swift,Fearless (Taylor's Version),1,1,1,5,3,2,50000,3000,100000,0.33,0.02,0.65,153000,10,0,0,8,6,1
2021-11-12,33,RE,--,False,False,10,--,Fearless (Taylor’s Version),Taylor Swift,Fearless (Taylor's Version),1,1,1,5,3,2,50000,3000,100000,0.33,0.02,0.65,153000,10,0,0,1,8,1
2021-11-12,34,RE,--,False,False,10,--,Bye Bye Baby (Taylor’s Version) (From the Vault),Taylor Swift,Fearless (Taylor's Version),1,1,1,5,3,2,50000,3000,100000,0.33,0.02,0.65,153000,10,0,0,12,5,1
2021-11-12,35,RE,--,False,False,10,--,Don’t You (Taylor’s Version) (From the Vault),Taylor Swift,Fearless (Taylor's Version),1,1,1,5,3,2,50000,3000,100000,0.33,0.02,0.65,153000,10,0,0,3,8,1
2021-11-12,36,NEW,--,True,False,10,--,That’s When (Taylor’s Version) (From The Vault),Taylor Swift Keith Urban,Fearless (Taylor's Version),1,1,1,5,3,2,50000,3000,100000,0.33,0.02,0.65,153000,10,0,0,36,1,1
2021-11-12,37,RE,--,False,False,10,--,We Were Happy (Taylor’s Version) (From the Vault),Taylor Swift,Fearless (Taylor's Version),1,1,1,5,3,2,50000,3000,100000,0.33,0.02,0.65,153000,10,0,0,2,8,2
2021-11-12,38,RE,--,False,False,10,--,Mr. Perfectly Fine (Taylor’s Version) (From the Vault),Taylor Swift,Fearless (Taylor's Version),1,1,1,5,3,2,50000,3000,100000,0.33,0.02,0.65,153000,10,0,0,4,9,1
2021-11-12,39,NEW,--,True,False,10,--,You All Over Me (Taylor’s Version) (From The Vault),Taylor Swift Maren Morris,Fearless (Taylor's Version),1,1,1,5,3,2,50000,3000,100000,0.33,0.02,0.65,153000,10,0,0,39,1,1
2021-11-12,40,NEW,--,True,False,10,--,Run (Taylor's Version) (From The Vault) [feat. Ed Sheeran],Taylor Swift,Red (Taylor's Version),1,1,1,5,3,2,50000,3000,100000,0.33,0.02,0.65,153000,10,0,0,40,1,1
2021-11-12,41,NEW,--,True,False,10,--,I Bet You Think About Me (Taylor's Version) (From The Vault) [feat. Chris Stapleton],Taylor Swift,Red (Taylor's Version),1,1,1,5,3,2,50000,3000,100000,0.33,0.02,0.65,153000,10,0,0,41,1,1
2021-11-12,42,RE,--,True,False,10,--,Nothing New (Taylor's Version) (From The Vault) [feat. Phoebe Bridgers],Taylor Swift,Red (Taylor's Version),1,1,1,5,3,2,50000,3000,100000,0.33,0.02,0.65,153000,10,0,0,42,1,1
2021-11-12,43,RE,--,True,False,10,--,State of Grace (Acoustic Version),Taylor Swift,Red (Taylor's Version),1,1,1,5,3,2,50000,3000,100000,0.33,0.02,0.65,153000,10,0,0,43,1,1
